<?xml version="1.0" encoding="utf-8"?>
<contratos xmlns:xsi="http://www.w3.org/2001/XMLSchema-instance" xsi:noNamespaceSchemaLocation="contratos.xsd">
	<municipio nomeMun="Arganil" />
	<municipio nomeMun="Cantanhede" />
	<municipio nomeMun="Coimbra" />
	<municipio nomeMun="Condeixa-a-Nova" />
	<municipio nomeMun="Figueira da Foz" />
	<municipio nomeMun="Góis" />
	<municipio nomeMun="Lousã" />
	<municipio nomeMun="Mira" />
	<municipio nomeMun="Miranda do Corvo" />
	<municipio nomeMun="Montemor-o-Velho" />
	<municipio nomeMun="Oliveira do Hospital" />
	<municipio nomeMun="Pampilhosa da Serra" />
	<municipio nomeMun="Penacova" />
	<municipio nomeMun="Penela" />
	<municipio nomeMun="Soure" />
	<municipio nomeMun="Tábua" />
	<municipio nomeMun="Vila Nova de Poiares" />
</contratos>
